1.75E+18,libat masyarakat susun uu sehat bantu pasti bijak hasil cermin butuh aspirasi publik tegakkanhukum kpk republik indonesia undangundang reformasihukum uukesehatan,Netral,,,
1.75E+18,libat organisasi profesi bentuk uu sehat sangat penting mereka bawa paham dalam praktik sehat butuh masyarakat tegakkanhukum kpk republik indonesia undangundang reformasihukum uukesehatan,Positif,,,
1.75E+18,susun uu sehat libat pertisipasi masyarakat tegakkanhukum kpk republik indonesia undangundang reformasihukum,Netral,,,
1.75E+18,uu sehat bpjs inacbg militer pend eh benar gas orang pintar mana reduksi sehat soal loyal instead of jujur menkes kontra idi tertawa race to the bottom kshatan the stunting discourse ya hahahah semangat lah bapak kata gweh,Positif,,,
1.75E+18,tani nelayan makmur sejahtera sisir regulasi rugi tani proteksi tani negara kuat kalau tani nelayan makmur sejahtera dik sehat rakyat jangan ribet anggar negara rapat pangkas miskin koruptor refisi uu ite,Positif,,,
1.75E+18,ikn yang paksa ada uu mau mau ttap di terus saja bapak anies ttap prinsip tara meski thapan mmbangun beliau mau mngorbankan urgen seperti sehat dik ksejahteraan rkyat,Negatif,,,
1.75E+18,salah alamat minta kemenkes jujur transparan sesuai informed consent uu sehat pasal ayat huruf soal aman,Positif,,,
1.17E+19,pause ada lebih prioritas bukan arti bangun henti karena ada uu anies bisa langgar uu kalau sekolah cukup didik bagus sehat mudah transportasi umum antar kota bagus baru bangun ikn,Positif,,,
1.75E+18,panteslah buzzerp uu sehat paaraaah memang,Netral,,,
1.75E+18,tpn paslon ganjar mahfud sampai posisi kait uu sehat omnibus law inti tanya uu sebut bahagia masyarakat,Positif,,,
1.75E+18,har gin lho bang misal uu sehat rancang diskusi para ahli organisasi profesi dokter bidan apoteker lain dan akademisi ajak bicara putus akhir dialog sebut baru bahas di sahkan bukan balik urut,Positif,,,
1.75E+18,nah benar maaf mas kudu posisi diri rakyat walaupun pilih kudu senang bicara uu omnibuslaw misal turun banyak rakyat yang tidak tuju apalagi soal sehat,Positif,,,
1.75E+18,bentar bukan dalam uu sehat pasal ayat larang jual organ tubuh,Netral,,,
1.75E+18,akar masalah anggap bpjs asuransi padahal dalam uu sendiri kata bpjs asuransi bagai mekanisme lindung sehat tenaga kerja,Netral,,,
1.75E+18,bagaimana datang dok bikin uu sehat baru orang,Positif,,,
1.75E+18,abg indah tanya ubah uu sehat cakup iur bpjs tahu telah putus ma nomor keluar pres ini hajat orang banyak hampir juta guna tahu berapa pasal ubah sekali ke bapak akibat itu berapa nunggak,Positif,,,
1.75E+18,indeed segala bentuk bijak ubah bahkan terus milik efek masyarakat and to be honest nakes kerja turut dampak besar who knows uu nomor tahun sehat ada tambah ubah,Positif,,,
1.75E+18,dong untuk realistis depan republik indonesia serius tentang pasal tembakau rpp uu sehat tolakpasaltembakaurppkesehatan tolaklaranganpajangrokok,Negatif,,,
1.75E+18,bijak buat tinjau kah buat lebih bijak bapak republik indonesia serius tentang pasal tembakau rpp uu sehat tolakpasaltembakaurppkesehatan tolaklaranganpajangrokok,Positif,,,
1.75E+18,benar dampak atur rpp sehat sektor ekonomi cukup serius republik indonesia serius tentang pasal tembakau rpp uu sehat tolakpasaltembakaurppkesehatan tolaklaranganpajangrokok,Negatif,,,
1.75E+18,akan tolak pasal tembakau rpp uu sehat makin susah jual rokok tidak ecer bapak republik indonesia tolakpasaltembakaurppkesehatan tolaklaranganrokokeceran tolaklaranganpajangrokok,Negatif,,,
1.75E+18,dagang tolak pasal tembakau rpp uu sehat akan kurang dapat masalah boleh jual ecer republik indonesia tolakpasaltembakaurppkesehatan tolaklaranganrokokeceran tolaklaranganpajangrokok,Netral,,,
1.75E+18,sembako semua makin mahal protes malah uu ite fitness alas sehat malah mahal hibur diri mahal terus mas bagussin era kepempinan sekarang malah dilanjutin cuma bilang goodluck semangat kerja rakyat medioker,Negatif,,,
1.75E+18,jumlah media masih tulis normatif soal laku aborsi prochoice prolife padahal uu sehat sebut aborsi boleh laku tentu tentu ada darurat medis atau jadi korban,Positif,,,
1.75E+18,owh pantes wajib pakai sap yak pantes buru kesah uu sehat,Netral,,,
1.75E+18,lanjut yang lebih parah banding uu omnibuslaw sehat,Positif,,,
1.75E+18,partai beliau pro uu sehat baru malas skip,Negatif,,,
1.75E+18,murni pikir akademisi bukan pikir politik moga depan perintah kesah uu atur kait sehat maju selalu libat nakes,Positif,,,
1.75E+18,ada uu nomor buat jadi geser paradigma yankes awal sosio ekonomi industri sehat orientasi pada profit mudah asing asing bisnis hayooo kata anti antek antek asing yh tidak datang bagaimana donk,Negatif,,,
1.75E+18,pernah bicara driver grab cerita dulu tidak teken kontrak pegawai tetap sah uu outsourcing dia cerita khawatir kalau menang peristiwa turun gusdur ulang karena masalah sehat mbak,Positif,,,
1.75E+18,selamat ulang tahun sayang paling gemoy kamu kerja keras saat jangan lupa jaga sehat kwann carat harap kamu bahagia lop uu happybooday happy seungkwan day,Positif,,,
1.75E+18,hari bidang banyak kalau kuliah ada nyinggung beberapa rekruitmen kompensasi pegawai pph jkm jht asuransi sehat iur pegawai tunjang lain manajemen sdm uu ketenagakerjaan ajar excel semangatt sendernyaa,Positif,,,
1.75E+18,ajar excel update atur paja ketenagakerjaan uu atur lain ajar bpjs sehat ketenagakerjaan sangat penting tidak ngang ngong,Positif,,,
1.75E+18,desak anies nakes minta bantu anies buat usung ulang uu sehat baru kena gizi tidak bisa str btsmyswlf tue jan maaf bapak sudah jadi sangka kasus jual organ tubuh mana jual organ tubuh larang uu sehat cmiiw,Negatif,,,
1.75E+18,memang berani gugat kamu bukan masalah uu sehat baru sah,Positif,,,
1.75E+18,bisa jual beli organ mirip gin anggap normal terus gimana uu sehat siapa beli pakai duit dokter siapa dia nunjukin surat janji loh,Positif,,,
1.75E+18,uu sehat harus kamu maki capres ikut,Netral,,,
1.75E+18,berani nyata cabut uu obl sehat produk regime bakal liberalisasi komersialisasi sektor sehat hapus mandatory spending apbn untuk apbd ancam selamat bangsa data genom bisa kelola asing,Negatif,,,
1.75E+18,uu sehat baru kesah wajib vaksinasi sangat langgar konstitusi tiap capres sampai sikap tentang isu rakyat hak tahu,Positif,,,
1.17E+19,rezim ada ini justru kesah wajib vaksinasi uu sehat baru sangat langgar konstitusi akan uji materiil maka tiap capres sampai sikap hadap,Positif,,,
1.75E+18,uu sehat gimana,Netral,,,
1.75E+18,chou republik indonesia itu domain kemenlu kenapa justru kemenlu kek cuci tangan malah serah sepenuh pssi kalau bicara uu kontitusi semua munafik begal fakta berapa banyak saudara masih susah dapat layan sehat didik layak tara,Positif,,,
1.75E+18,inti kak smenjak sah uu sehat baru buat panjang str gizi lampir sertifikat ukom profesi nah masalahny semua sekolah buka profesi full kuliah tahun kalau kota kampus buka profesi,Positif,,,
1.75E+18,bicara deal uu sehat,Netral,,,
1.75E+18,inul jelas uu hkpd rangka harmonisasi uu ciptaker jeneng baca uunya lembar ada halaman pasal mas sudah bilang hkpd lanjut uuciptaker uupemda ada uu yang makan korban salah satu uu omnibus sehat,Negatif,,,
1.75E+18,gin bapak republik indonesia banyak masyarakat tolak pasal tembakau rpp uu sehat tolakpasaltembakaurppkesehatan dicuekin tuh kangen iklan rokok edukasi mirip pakai jin gosok aladin juga,Positif,,,
1.75E+18,benar bapak republik indonesia dengerin seru banyak masyarakat tolak pasal tembakau rpp uu sehat tolakpasaltembakaurppkesehatan masak sudah koar selalu tidak langkah begitu sih,Positif,,,
1.75E+18,tengyuu maenggg marshajkt jaga sehat terus yakk lovv uu moreee,Positif,,,
1.75E+18,bapak republik indonesia banyak masyarakat tolak pasal tembakau rpp uu sehat tolakpasaltembakaurppkesehatan masak dicuekin terus mesti gimana coba dengar,Positif,,,
1.75E+18,btw bapak republik indonesia tengah banyak masyarakat tolak pasal tembakau rpp uu sehat tolakpasaltembakaurppkesehatan percaya kalau dicuekin abai sakit rasa bisa minimal ditanggepin dulu,Negatif,,,
1.75E+18,sih harus lebih sadar kalau rugi masyarakat republik indonesia serius tentang pasal tembakau rpp uu sehat tolakpasaltembakaurppkesehatan tolaklaranganpajangrokok,Positif,,,
1.75E+18,aneh sih kamu semua rokok ecer larang terus deh republik indonesia serius tentang pasal tembakau rpp uu sehat tolakpasaltembakaurppkesehatan tolaklaranganpajangrokok,Negatif,,,
1.75E+18,dagang kecil tindas laku atur ya republik indonesia serius tentang pasal tembakau di rpp uu sehat tolakpasaltembakaurppkesehatan tolaklaranganpajangrokok,Negatif,,,
1.75E+18,larang jual rokok ecer mati dapat dagang kecil tentang pasal tembakau rpp uu sehat republik indonesia tolakpasaltembakaurppkesehatan tolaklaranganrokokeceran tolaklaranganpajangrokok,Negatif,,,
1.75E+18,bapak republik indonesia tunggu deh diskusi bareng masyarakat tolak pasal tembakau rpp uu sehat tolakpasaltembakaurppkesehatan cari solusi sedih tahu bapak abai,Negatif,,,
1.75E+18,kasihan dagang kecil dapat berapa sekarang makin rugi tentang pasal tembakau rpp uu sehat republik indonesia tolakpasaltembakaurppkesehatan tolaklaranganrokokeceran tolaklaranganpajangrokok,Positif,,,
1.75E+18,pasti rugi banyak pihak tolong bapak republik indonesia serius tentang pasal tembakau rpp uu sehat tolakpasaltembakaurppkesehatan tolaklaranganpajangrokok,Positif,,,
1.75E+18,bapak minta sekali dong resah sekali republik indonesia serius tentang pasal tembakau rpp uu sehat tolakpasaltembakaurppkesehatan tolaklaranganpajangrokok,Negatif,,,
1.75E+18,asli deh bapak republik indonesia coba lihat masyarakat tolak pasal tembakau rpp uu sehat tolakpasaltembakaurppkesehatan jangan abai bisa cari jalan tengah buat cari solusi sama,Positif,,,
1.75E+18,tentang pasal tembakau rpp uu sehat rugi dagang kecil republik indonesia tolakpasaltembakaurppkesehatan tolaklaranganrokokeceran tolaklaranganpajangrokok,Negatif,,,
1.75E+18,padahal jual rokok ecer berapa untung pokok tentang pasal tembakau rpp uu sehat republik indonesia tolakpasaltembakaurppkesehatan tolaklaranganrokokeceran tolaklaranganpajangrokok,Negatif,,,
1.75E+18,paling seru kait uu sehat perihal izin praktik dokter kemarin sempat polemik idi organisasi profesi dokter,Positif,,,
1.75E+18,resentralisasi bukan pada pajak hibur justru semua sektor bapak sejak uu pemda susul ui ciptaker uu hkpd jadi resentralisasi susul uu sehat ruu omnibus uang saya bukan simpatisan pks masih ngisep rokok surya,Positif,,,
1.75E+18,tvr komis ix dpr republik indonesia tegas libat publik susun uu sehat dpr republik indonesia minta mahkamah konstitusi tolak gugat uji formil atas uu nomor tahun sehat tvrparlemen livestreaming breakingnews dprri tvr,Netral,,,
1.75E+18,webinar tuju cipta momentum penting tumbuh sadar kolektif urgensi implikasi uu sehat,Positif,,,
1.75E+18,yr cepat selesai uu cipta kerja uu sehat uu ikn uu revisi uu tambah tentu kena omnibus kalau ambil benang merah kelompok usaha biasa sebut investor ini paling untung uu sehat fokus aspek bisnis,Positif,,,
1.75E+18,kayak can decide my vote dengar doi jawab soal uu sehat bagaimana ada tanya,Netral,,,
1.75E+18,uu nomor moga banyak bahas lulus sehat masyarakat makin kucil minat tuh banyak beberapa minat anggap tenaga sehat huft,Positif,,,
1.75E+18,harus tinjau sisi sehat hewan masyarakat potensi zoonosis batas hewan ternak dapat konsumsi sudah sebut uu belum anjing anjing sebut banyak hasil curi sekali bahas sisi hukum,Positif,,,
1.75E+18,ingat uu sehat bukan produk liberalisasi nakes,Netral,,,
1.75E+18,punten dok bagaimana upaya atas senjang fasilitas tunjang daerah pusat perifer dokter spesialis bisa praktik daerah tidak sedia alat cukup tindak lanjut uu omnibus law sehat rugi nakes rakyat,Negatif,,,
1.75E+18,bahkan form dokter hewan diinclude memang sesuai uu tenaga sehat merincikan dokter hewan tetapi sangat sayang,Positif,,,
1.75E+18,bilang kalau uu sehat jelek jadi nakes gegara tetap laku dan kasih toleransi buat lulus sgz sudah ukom tahun itu aneh,Negatif,,,
1.75E+18,mungkin cuma ken titip tanya tanggap uu sehat baru terus kalau uu masalah apa langkah akan ambil untuk baik uu sebut gimana strategi akan laku bpjs sehat defisit,Positif,,,
1.75E+18,bapak bagaimana implementasi uu sehat baru bagi omnibus law hapus banyak uu kait sehat belum tingkat sejahtera profesi tenaga sehat ada ken tahu berapa ingin bapak sejahtera nakes,Positif,,,
1.75E+18,asyik bahas uu omnibus sehat,Positif,,,
1.75E+18,cipeng uu sehat hmmm,Netral,,,
1.75E+18,bagai organisasi libat sejak uu sehat susun baleg dpr republik indonesia tegakkanhukum kpkri undangundang,Netral,,,
1.75E+18,misal presiden maksa micinisasi lockdown korban tuntut lepas atur kemenkes ganti rugi personal kalau mereka cuma bisa tuntut atur hukum umum uu sehat ganti rugi negara,Negatif,,,
1.75E+18,kaaaaa rest well yaaaa take ur time kamu jaga sehat ll miss uu,Netral,,,
1.75E+18,ubah pt askes persero cakup luas pegawai bumn uu sjsn pt askes tunjuk jalan uu sjsn ubah bpjs sehat bpjs sehat operasi,Netral,,,
1.75E+18,inul salah sendiri dukung uu cipta kerja jelas perintah becus percaya makin gemuk koalisi makin bejat laku rumus cek sehat demokrasi oposisi jadi menteri buruk yang terima lebih buruk timbul tenggelam sama rakyat,Negatif,,,
1.75E+18,omnibuslaw uu sehat acak acak hadeuh,Negatif,,,
1.75E+18,jaga sehat raa makan atur minum air cukup terus jangan lupa balikk jugaa see uu,Netral,,,
1.75E+18,uu cipataker uu karantina sehat kontribusi krisis sehat didik ekonomi sedang alami tahun akhir,Positif,,,
1.75E+18,lalu atur perintah pp turun undang undang uu nomor sehat nanti perintah atur jumlah tentu produksi impor produk tembakau rokok elektrik kendali larang tentu larang iklan sponsorship,Netral,,,
1.75E+18,guys terang ya omnibus law banyak hanya uu ciptaker juga uu sehat uu hkpd saya bahas atas betul tiga uu tolak semua,Positif,,,
1.75E+18,wahh ada sidang ubah uu sehat biar lebih cepat langsung ketok palu,Positif,,,
1.75E+18,nah tuju antipati anak fk pas uu sehat kerja buah bodoh malah bagi besaqr uu sana atur didik dokter saat dokter mereka depan ingat nasihat dosen harga beras juga tentu politik,Negatif,,,
1.75E+18,uu sehat uu hkpd uu ciptaker buat metode omnibus dapat reaksi tolak bagai daerah prosedur buat konten salah satu tolak pasuruan kampung mbak inul,Negatif,,,
1.75E+18,iai sempet draft disetorin diprint buat masuk uu sehat baru tidak baca,Positif,,,
1.75E+18,betul produk hukum libat aspirasi banyak pihak pas ganjar sambut pit iai solo kemarin cerita proses uu sehat pada ribut besar bahkan kalang susun buat dim sendiri,Positif,,,
1.75E+18,omnibus law saya lihat masalah semua ciptaker hkpd ke uu sehat saya bisa gara sifat omnibus makanya masalah pakar hukum bisa jelas,Netral,,,
1.75E+18,kampung tolak who pandemic treaty masa depan mana who rubah uu sehat dunia mana negara tunduk hilang daulat jadi pandemic masa depan,Netral,,,
1.75E+18,yang lebih feasible reliable contoh contract farming kuat kpk review uu kpk review omnibus law sehat cipta kerja ampas aset sistem meritokrasi lain,Positif,,,
1.75E+18,kombinasi enas bpjs uu sehat cerita buah rsud spb konflik manajemen minta lebih aman spb fg cari tempat dekat dirut spb lama pindah rsud desa fg masuk punya sip rekom yang syarat tuju senior tidak perlu,Positif,,,
1.75E+18,tunjuk anggota kki abai rekomendasi masuk ti ketua ti promotor jadi profesor hormat uu sehat sah tak tunggal bentuk pdsi mayoritas militer kki aku pdsi tara idi,Negatif,,,
1.75E+18,subsidi dicabutin mirip subsidi bbm sehat terus gara uu omnibus law layoff makin semena omnibus law persentase naik umr kecil ppn juga mau buat progressive mau dinaikin dah,Positif,,,
1.75E+18,lebih ironis uu sehat nomor tahun sah dpr republik indonesia sambut baik para laku usaha rokok elektronik perlu kaji oleh kemenkes republik indonesia program who realisasi laporsehat who vape hilir,Positif,,,
1.75E+18,maroo belum wan na say thank uu sudah ada ini izin kak ikut iniii nct all unit especially uri haechanie juga kak maro sudah sayang nct doa moga serta semua selalu beri sehat,Negatif,,,
1.75E+18,delapan pohon paku ganggu sehat tumbuh pohon itu larang uu langgar uu maklum cihhh,Negatif,,,
1.75E+18,paham masa depan indonesia boleh lepas geopolitik internasional saat sedang gejolak skenario global pandemi lanjut vaksinasi pakat who pandemic treaty moga anis mampu tolak uu sehat internasional,Positif,,,
1.75E+18,patters hukum tumpul atas tajam bawah antara omnibus law uu uu ite jilid lemah kpk ruu sehat,Negatif,,,
1.75E+18,tolak uu obl sehat,Netral,,,
1.75E+18,lihat jalan pks tahun akhir on the track jalur oposisi terus juang parlemen tolak tolak revisi uu kpk tolak uu cipta kerja tolak revisi uu sehat tolak uu ikn pks sangat mungkin masuk besar,Positif,,,
1.75E+18,banyak dampak bapak sangat rugi sepakat tolak pasal tembakau rpp uu sehat tembakaudizolimi tolakpasaltembakaurppkesehatan republik indonesia,Positif,,,
1.75E+18,bapak kaji ulang ini bapak sepakat tolak pasal tembakau rpp uu sehat tembakaudizolimi tolakpasaltembakaurppkesehatan republik indonesia,Netral,,,
1.17E+19,industri pabrik maupun jual warung dadak kacau bapak sepakat tolak pasal tembakau rpp uu sehat tembakaudizolimi tolakpasaltembakaurppkesehatan republik indonesia,Netral,,,
1.75E+18,benar ada sadar bisa pihak besar besar republik indonesia dengerin benar tolak larang jual ecer rpp uu sehat tolakpasaltembakaurppkesehatan tolaklaranganrokokeceran,Positif,,,
1.75E+18,semenjak jual rokok warung larang omset keluarga jadi turun benar tolak larang jual ecer rpp uu sehat tolakpasaltembakaurppkesehatan tolaklaranganrokokeceran,Negatif,,,
1.75E+18,masalah akan up terus ketemu jalan keluar pihak rakyat dengerin tolak larang jual ecer rpp uu sehat tolakpasaltembakaurppkesehatan tolaklaranganrokokeceran,Netral,,,
1.75E+18,moga rencana larang tidak ya bapak republik indonesia moga suara tolak pasal tembakau rpp uu sehat dengar tolakpasaltembakaurppkesehatan tembakaudizolimi,Netral,,,
1.75E+18,tolak pasal tembakau rpp uu sehat karena jangan industri kreatif utama iklan rokok kualitas turun republik indonesia tolakpasaltembakaurppkesehatan tembakaudizolimi,Positif,,,
1.75E+18,moga suara tolak pasal tembakau rpp uu sehat dengar republik indonesia orang orang kerja industri kreatif iklan tidak dampak tolakpasaltembakaurppkesehatan tembakaudizolimi,Positif,,,
1.75E+18,toloh ditindaklanjuti soal tolak pasal tembakau rpp uu sehat bapak republik indonesia lama iklan rokok salah satu iklan yang kualitas banyak makna soal tolakpasaltembakaurppkesehatan tembakaudizolimi,Netral,,,
1.75E+18,perintah kapan mau dengar keluh rakyat kecil tolak pasal tembakau rpp uu sehat republik indonesia tolakpasaltembakaurppkesehatan,Negatif,,,
1.75E+18,oke ada ruu tembakau kalau orang industri kreatif jadi ya kasihan mereka makanya tolak pasal tembakau rpp uu sehat bapak republik indonesia tolakpasaltembakaurppkesehatan tembakaudizolimi,Positif,,,
1.75E+18,pantes banyak tolak pasal tembakau rpp uu sehat mesti gimana orang industri kreatif deh bapak republik indonesia tolakpasaltembakaurppkesehatan tembakaudizolimi,Positif,,,
1.75E+18,tambah tolak ruu dkj jadi gubernur pilih presiden tolak uu sehat tolak naik bbm subsidi tuju rkuhp berat pasal hina presiden lembaga negara sering potong gaji anggota dpr ada bencana alam,Netral,,,
1.75E+18,tidak pernah lelah tolak pasal tembakau rpp uu sehat perintah ubah atur republik indonesia tolakpasaltembakaurppkesehatan,Negatif,,,
1.75E+18,bagai pihak tolak pasal tembakau rpp uu sehat perintah tetap kes abai republik indonesia tolakpasaltembakaurppkesehatan,Positif,,,
1.75E+18,sampai kapan perintah abai kami tolak pasal tembakau rpp uu sehat republik indonesia tolakpasaltembakaurppkesehatan,Netral,,,
1.75E+18,garis lucu harus republik indonesia boleh kasih syarat batas usia contoh uukesehatan sekarang kasih bebas bebas orang kuliah dokter dokter spesialis pandang usia republik indonesia ababil republik indonesia,Positif,,,
1.75E+18,dpr soal gugat uu sehat maka telah libat partisipasi publik susun,Netral,,,
1.75E+18,enestee umm masalah etika cuma goreng lawan politik sekarang waktu detik detik pilpres uu syarat daftar capres cawapres wajib lulus syarat sehat akhir gusdur gagal pencapresan terus syarat didik turun sma,Negatif,,,
1.75E+18,ingin ganjar jadi presiden selesai uu sehat utama lulus semua butuh kerja kalau batas mana kerja sesuai bidang yuk ganjar yuk,Positif,,,
1.75E+18,silalahi uu sehat beri hak calon pasien pasien tolak terima tindak medis tahu strata hukum uu atas inpres ks tapi intruksi presiden atas rekomendasi who bapak who bawah pbb pbb organisasi jelas lanjut,Positif,,,
1.75E+18,bijak tepat tunggu bapak republik indonesia dengerin benar tolak larang jual ecer rpp uu sehat tolakpasaltembakaurppkesehatan tolaklaranganrokokeceran,Positif,,,
1.75E+18,betul perintah liat dari industri inti tembakau dampak bukan dagang usaha soal rpp uu sehat tolakpasaltembakaurppkesehatan republik indonesia,Positif,,,
1.75E+18,coba deh bapak republik indonesia lihat masyarakat tolak pasal tembakau rpp uu sehat tolakpasaltembakaurppkesehatan moga resah bisa timbang,Netral,,,
1.75E+18,berapa lama suara tolak pasal tembakau rpp uu sehat republik indonesia tolakpasaltembakaurppkesehatan abai deras penolakanrpp sehat,Positif,,,
1.75E+18,yakin bapak republik indonesia mau kaji ulang padahal banyak tolak pasal tembakau rpp uu sehat lho tolakpasaltembakaurppkesehatan,Positif,,,
1.75E+18,banyak tolak pasal tembakau rpp uu sehat gin mending kaji ulang lebih timbang aspek deh bapak republik indonesia tolakpasaltembakaurppkesehatan,Positif,,,
1.75E+18,komitmen ganjar mahfud sejahtera buruh moga aspirasi yang revisi uu cipta kerja soal pihak batas tenaga kerja asing rumah jamin sehat didik buat anak anak akan wujud tang bapak ganjar,Negatif,,,
1.75E+18,sdgs janji kurang emisi karbon great reset energi hijau uu omnibuslaw sehat uu cilaka semua bagi proyek,Positif,,,
1.75E+18,dukung langkah kpu pasti kesiap sehat utama teman tugas kpps beban kerja kpps sangat besar akibat uu milu belum hasil ubah alam milu ratus tugas kpps jatuh sakit wafat akibat lelah boleh ulang,Negatif,,,
1.75E+18,buat regulasi khusus undang undang jamin selamat pasien sehat masyarakat pantau rangkai sidang laman courtizen mengawalkonstitusi salamkonstitusi mkri uukesehatan,Netral,,,
1.75E+18,sidang pertama di maka gelar sidang lanjut uji formil uu sehat mohon sekretariat sama organisasi profesi sehat,Positif,,,
1.75E+18,seri webinar strategi rs pasca laku uu nomor sehat topik kelola rs tumpu bpjs,Netral,,,
1.17E+19,silalahi kampung banyoe indonesia butuh who hapus daulat rakyat hak sehat dasar semua jahat nyata atas sah dpr masuk uu sehat baru,Positif,,,
1.75E+18,uu ikn cipta kerja hip uu sehat lain yang sah puan bahas ruu ampas aset masuk konsistensi jaga demokrasi tidak perlu puji itu baik kata baik sangat balik hilang simpati rakyat kalau itu,Positif,,,
1.75E+18,tj perlu ingat dulu konsisten tolak ruu sehat omnibus law akhir sah jadi uu pks demokrat saat tinggal satu partai masih konsisten barangkali bisa clue teka teki atas,Positif,,,
1.75E+18,uukesehatan pakai tiada rs type khusus tinggal gub tengara kini rs khusus jiwa amino alih rsu md indo koko twit,Positif,,,
1.75E+18,haechan kamuu kerenn kamu hebat proudd of uu hasil ngelawan sakit beberapa hari kemarin jaga sehat cintaaa sayang,Positif,,,
1.75E+18,kalau bilang vaksinasi wajib uu sehat baru jawab pasal ayat huruf soal aman artikel who soal polio akibat vaksin alas tolak,Positif,,,
1.75E+18,iya lupa revisi uu sudah bukan tenaga sehat,Netral,,,
1.75E+18,makanya jangan sering twittwar kemarin ribut pro kontra uu sehat sedang sibuk pilpres milu lagi sibuk wa grup seperti mobilisasi teman teman nomor apakah banyak keluar wa grup,Positif,,,
1.75E+18,kampung yes itu vaksinasi opv tindak pidana sesuai uu sehat baru buat oleh kemenkes,Positif,,,
1.75E+18,vaksinasi tetes polio bukti sebab polio tindak pidana virus hidup dalam vaksin adalah agen biologi bukan potensi sebab klb sudah sebab klb uu sehat baru pasal orang larang laku,Negatif,,,
1.75E+18,ingat kamu uu sehat masa depan bakal saing bukan orang sini tetapi dokter luar gaperlu tara enak sangat mereka bakal saing di kota terus kita mana paksa ke pelosok bad thing,Positif,,,
1.75E+18,sori jbjb dok kalau banyak dipaslon mana partai dukung uu sehat uu ciptaker tidak saya pilih ya dok narasi lari kesana kemari dok,Positif,,,
1.75E+18,anestesi gaskeuuun uu sehat cabut,Netral,,,
1.75E+18,dampak kalau rpp uu sehat sah bukan pkl industri kreatif juga sih tolak sangat kalau di sahkan tolakpasaltembakaurppkesehatan tembakaudizolimi republik indonesia,Positif,,,
1.75E+18,jls rpp uu sehat banyak kasih dampak negatif beberapa aspek industri ekonomi kreatif kena hrsnya timbang tolakpasaltembakaurppkesehatan tembakaudizolimi,Positif,,,
1.75E+18,harus perintah bijak dalam buat atur masyarakat tentang pasal tembakau rpp uu sehat tolakpasaltembakaurppkesehatan tolaklaranganrokokeceran tolaklaranganpajangrokok republik indonesia,Positif,,,
1.75E+18,perintah tindak apa yaudah kami tentang pasal tembakau rpp uu sehat tolakpasaltembakaurppkesehatan tolaklaranganrokokeceran tolaklaranganpajangrokok republik indonesia,Netral,,,
1.75E+18,harus rpp uu sehat dong revisi batas ada iklan rokok padahal dampak besar di industri kreatif tolakpasaltembakaurppkesehatan tolaklaranganrokokeceran tolaklaranganpajangrokok,Positif,,,
1.75E+18,memang tolak pasal tembakau rpp uu sehat rugi coba ada iklan rokok turun dapat dagang republik indonesia tolakpasaltembakaurppkesehatan tembakaudizolimi,Negatif,,,
1.75E+18,semua tolak pasal tembakau rpp uu sehat pengaruh iklan rokok besar buat dagang solusi republik indonesia tolakpasaltembakaurppkesehatan tembakaudizolimi,Netral,,,
1.75E+18,dagang kecil dampak rpp uu sehat baik bijak memang bijak unt semua pihak republik indonesia tolakpasaltembakaurppkesehatan tolaklaranganrokokeceran tolaklaranganpajangrokok dagang,Positif,,,
1.75E+18,salah republik indonesia jadi malapetaka rakyat indonesia harus jabat kait periksa uu darurat sehat nasional,Netral,,,
