1.75E+18,agenda misi nomor baru evaluasi besar bayar fasilitas sehat tingkat lanjut ina cbgs sesuai tentu uu sjsn juga evaluasi besar bayar fasilitas sehat tingkat pertama kapitasi non kap permenkes anestesi,Positif,,,
1.74E+18,cipeng uukesehatan kasih bebas sekolah ppds usia berapa asal mampu hahahaha,Positif,,,
1.74E+18,uukesehatan barusan sah kilat contoh liberalisasi sektor sehat ngeri,Netral,,,
1.74E+18,sayang itu buat amburadul uu sehat pro kapitalis amin peduli batal kacau sekali si irma chaniago salah satu gembong,Negatif,,,
1.74E+18,simpul sehat juga perlu tunjuk komitmen anggar sehat dengan uu baru mandatory spending hapus,Positif,,,
1.74E+18,kalau bapak anies menang mohon evaluasi uu cilaka omnibuslaw bidang sehat bapak,Positif,,,
1.74E+18,uu sehat baru langgar konstitusi tidak hormat daulat rakyat bagaimana vaksin polio sebab polio kita perlu audit tindak covid ada vaksin imunisasi aman jawab twitter space,Positif,,,
1.74E+18,faskes rs buka lebar masuk nakes aseng kalian diam hilir eek dinosaurus hahahaha uukesehatan,Positif,,,
1.74E+18,kalau lihat bagai laku seni nakes representasi penting ingat hadir absurd perintah belum kait bijak ai uu sehat harap benar kerja juang jawat,Positif,,,
1.74E+18,cuma doa ecill cepat sembuh much better than yesterday ll try to be sincere even though bit difficult but okayyy penting sehat ecilll love uu ecilll hug hug,Positif,,,
1.74E+18,aborsi uu nomor tahun sehat,Netral,,,
1.74E+18,ikut twitter space tadi malam ini link rekam soal uu sehat audit covid mati akibat covid imunisasi anak aman vaksin polio yang sebab vaksin lain sangat tarik,Positif,,,
1.74E+18,timur ketok palu uu protokol sehat siapa,Netral,,,
1.74E+18,atur jelas rugi dagang dari kami buat putus tentang pasal tembakau rpp uu sehat tolakpasaltembakaurppkesehatan tolaklaranganrokokeceran tolaklaranganpajangrokok republik indonesia,Positif,,,
1.74E+18,omset dagang turun drastis tidak bijak adil lebih baik tentang pasal tembakau rpp uu sehat tolakpasaltembakaurppkesehatan tolaklaranganrokokeceran tolaklaranganpajangrokok republik indonesia,Positif,,,
1.74E+18,kemenparekraf turun tangan padahal jelas kalau rpp uu sehat sah itu timbul dampak negatif beberapa industri tolakpasaltembakaurppkesehetan tolaklaranganrokokeceran tolaklaranganpajangrokok,Negatif,,,
1.74E+18,padahal jls dampak dari bagai aspek rpp uu sehat sah arti cari solusi baik dong tolakpasaltembakaurppkesehetan tolaklaranganrokokeceran tolaklaranganpajangrokok,Positif,,,
1.74E+18,misal rpp uu sehat sah arti perintah siap dong cari solusi dampak bukan cuma pkl loh tolakpasaltembakaurppkesehetan tolaklaranganrokokeceran tolaklaranganpajangrokok,Positif,,,
1.74E+18,dagang kecil tolak pasal tembakau rpp uu sehat republik indonesia kasihan kalau dapat turun boleh jual rokok ecer tolakpasaltembakaurppkesehetan tolaklaranganrokokeceran tolaklaranganpajangrokok,Negatif,,,
1.74E+18,coba deh republik indonesia masa rokok bisa jual ecer turun omset umkm tolakpasaltembakaurppkesehetan tolaklaranganrokokeceran tolaklaranganpajangrokok tolak pasal tembakau rpp uu sehat,Netral,,,
1.74E+18,dapat dagang kurang dong bapak republik indonesia tolak pasal tembakau rpp uu sehat tolakpasaltembakaurppkesehatan tolaklaranganpajangrokok,Netral,,,
1.74E+18,bang kamu jangan malu yunior kamu dulu prd undang jadi ramai debat dpr syarat ijazah sehat proses buat uu jauh waktu hari daftar capres pikun wajar tahun sering cek sehat deh bang,Positif,,,
1.74E+18,dumdum makan uu sehat kalian sahkan hahahaha,Positif,,,
1.74E+18,catat mulai besok akan dukung siapa calek demokrat lintas tl sudah jelas tahun oposisi tolak omnibus law dan tolak uu sehat dulu kalian puja puji jan pilpres dengki kalian rusak akal sehat salam,Positif,,,
1.74E+18,bapak tim dong desak anies edisi khusus pet lover banyak sangat lho butuh dari atur uu siksa hewan pelihara fasilitas sehat konservasi lestari terus tahu dong program,Positif,,,
1.74E+18,malam twitter space jam malam wib akan bahas isu konstitusionalitas uu sehat baru bagai topik yang penting kait sehat daulat rakyat,Positif,,,
1.74E+18,omnibus cipta kerja omnibus uu sehat padahal banyak tolak ketok palu terus langgar konstitusi kira kalau menang periode depan milu tidak kan atur ubah mau rakyat protes skip,Positif,,,
1.74E+18,jauh ajar ajar pkn bang btw lulus sehat putus turut tidak fair tanpa libat legislatif dpr dpd wong sederhana uu harus dapat tuju dpr,Negatif,,,
1.74E+18,malam twitter space kampung jam wib juga bahas isu konstitusionalitas uu sehat baru bagai topik yang penting milu,Positif,,,
1.74E+18,titip tanya buat tiga pasal ayat uu sehat baru cabut semua hak dasar medis informed consent ada klb cabut semua hak dasar medis bagaimana tanggap,Positif,,,
1.74E+18,organisasi dukung uu sehat kemarin juga dok,Netral,,,
1.74E+18,nyata di konversi anies kalah jadi rebut anas urbaningrum bukankah anas urbaningrum gagal usaha gusdur nyapres turanan uu kpu masalah sehat di klarifikasi bang,Netral,,,
1.74E+18,maaf bang zen kawan kurang akurat informasi konteks bicara proses politik normal elit politik kompromi ubah atur sehat jelang milu ijazah memang uu suara sangat kuat ubah jadi sma muncul,Positif,,,
1.74E+18,nangisin omnibus law nangisin ciptakerja ruu sehat ruu kpk lain ini nangisin capres sudah punya uang banyak turun aman itu uu rugi orangtua kamu saudara kamu bahkan masa depan kamu kaga kamu tangisin goblok,Positif,,,
1.74E+18,tarik ken liat tanggap srmua uu sehat baru dini masalah banyak organisasi profesi sehat,Positif,,,
1.75E+18,terap undang undang sehat cipta landas upaya cegah kendali sakit tropis undangundang,Netral,,,
1.75E+18,undang undang harap buka peluang investasi sektor sehat tegakkanhukum,Negatif,,,
1.75E+18,caries undang undang sehat dukung upaya kendali sakit tular dapat cegah lalu vaksinasi kpkri,Netral,,,
1.75E+18,caries undang undang sehat upaya pasti ada regulasi jelas kait guna teknologi medis undangundang,Netral,,,
1.75E+18,undang undang sehat dukung upaya kembang layan sehat keluarga komunitas undangundang,Netral,,,
1.75E+18,perintah lalu menteri sehat kemenkes tengah rancang draf rancang atur perintah turun undang undang uu nomor tahu,Netral,,,
1.75E+18,maswis padahal undang undang jelas sehat didik salah satu hak warga negara,Negatif,,,
1.75E+18,dinas sehat kab minahasa selatan atas nama dakwa ffm agenda periksa dakwa dakwa dakwa langgar pasal ayat pasal jo pasal undang undang nomor tahun berantas tindak pidana korupsi bagaimana,Negatif,,,
1.75E+18,lalu giat ini lapas perempuan gorontalo penuh hak sehat narapidana tahan oleh layan sehat layak sesuai undang undang nomor tahun masyarakat kemenkumham gorontalo lapas perempuan gorontalo,Positif,,,
1.75E+18,moga suatu ada gugat undang undang bpjs sehat laku umur hidup kasihan masyarakat tidak bayar bapak tidak semua diakomodir bpjs non pbi terima bantu iur mhd,Negatif,,,
1.75E+18,bpjs wajib negara ada undang undang hasil iur jumlah sangat banyak peran negara penuh kalau dana cover sehat serta bpjs dicover iur ideal semua serta bpjs gratis acu undang undang,Positif,,,
1.75E+18,benar hampir semua masyarakat mau vaksin apa daya kepala masyarakat todong undang undang sehat kalau mau vaksin,Netral,,,
1.75E+18,sobatq semua hewan produk hewan bawa masuk indonesia lengkap dokumen sehat negara asal tidak lengkap tentu tugas karantina akan laku tindak karantina sesuai undang undang,Positif,,,
1.75E+18,lalu undang undang sehat perintah komitmen lindung tingkat sehat warga negara undangundang,Netral,,,
1.75E+18,undang undang sehat dorong tingkat kapasitas tenaga sehat tangan gawat darurat tegakkanhukum,Negatif,,,
1.75E+18,undang undang sehat atur hak hak pasien oleh informasi jelas obat undangundang,Netral,,,
1.75E+18,undang undang sehat dukung upaya promosi sehat mental tempat kerja tegakkanhukum,Negatif,,,
1.75E+18,bukan yang sangkut kondisi sehat pasien aka rekam medis memang atur undang undang kalau memang sifat rahasia bisa buka kasus tentu minta polisi penting hukum bagai jadi bukan konsumsi publik,Negatif,,,
1.75E+18,quiz soal blok sehat lingkung lebih undang undang sih,Positif,,,
1.75E+18,undang undang sehat atur hak pasien dapat informasi kena riwayat medis kpkri,Netral,,,
1.75E+18,id layan sehat gratis benar jamin undang undang dasar nri tahun pasal ayat tiap orang hak hidup sejahtera lahir batin tempat tinggal dapat lingkung hidup baik sehat hak oleh layan,Positif,,,
1.75E+18,laku edar obat obat larang sebut jerat pasal juncto pasal ayat subsider pasal juncto pasal undang undang nomor tahun sehat ancam hukum penjara paling lama tahun penjara,Positif,,,
1.75E+18,soal revisi undang undang sehat anies baswedan sebut ini bila empat itu koreksi bicara spektrum luas mulai bijak bijak sektoral mikro yang makro,Positif,,,
1.75E+18,undang undang sehat dukung upaya lindung hak hak kerja sektor sehat mental,Negatif,,,
1.75E+18,lrc kjham laku damping obat sehat jiwa rsj amino gondohutomo semarang dalam undang undang nomor tahun tindak pidana keras seksual pasal ayat korban hak atas tangan lindung pulih sejak jadi tindak pidana,Negatif,,,
1.75E+18,banyak sangat percaya patuh kata kiayi apa kata itu ketimbang undang undang tenaga sehat,Positif,,,
1.75E+18,tukang bentuk undang undang bicara sehat makin curiga ada undang undang yang sah,Netral,,,
1.75E+18,laksana patrol dialogis beri himbauan nelayan dagang ikan tetapi puger tidak pakai bahan awet bahaya sehat formalin tidak memperjualbelikan ikan lindung undang undang,Negatif,,,
1.75E+18,terap undang undang sehat cipta landas tingkat layan sehat daerah batas tegakkanhukum,Netral,,,
1.75E+18,materi diberikaan beri erti beda ancam hukum undang undang sehat narkotika ungkap kemenkumham jabar andika dwi prasetya,Netral,,,
1.75E+18,kepala lapas kelas iib indramayu ungkap materi sampai giat sebut tentang undang undang sehat narkotika kemenkumham jabar andika dwi prasetya,Netral,,,
1.75E+18,lalu atur perintah pp turun undang undang uu nomor sehat nanti perintah atur jumlah tentu produksi impor produk tembakau rokok elektrik kendali larang tentu larang iklan sponsorship,Netral,,,
1.75E+18,terap undang undang sehat cipta landas upaya promosi sehat reproduksi kpkri,Netral,,,
1.75E+18,lindung kerja prancis milik undang undang kerja kuat hak hak kerja liput lindung putus hubung kerja jamin sejahtera akses layan sehat,Positif,,,
1.75E+18,topik diskusi ning marngop bagi virus tingkat imunitas daya juang tangguh patuh undang undang ning cuk sore topik main ps bal tingkat imunitas sehat mental iki contoh bengi,Negatif,,,
1.75E+18,ketua komisi ix dpr republik indonesia emanuel melkiades laka lena tegas susun rancang undang undang sehat libat partisipasi publik,Netral,,,
1.75E+18,buat regulasi khusus undang undang jamin selamat pasien sehat masyarakat pantau rangkai sidang laman courtizen mengawalkonstitusi salamkonstitusi mkri uukesehatan,Netral,,,
1.75E+18,mau komen nyata yang pikir guna staff ahli naon yak kalau ngurusin bagaiman undang undang gimana cara peran dpr bagai seperti latih cukup kalau misal undang undang soal soal sehat terus isi nya sehat,Positif,,,
1.75E+18,terap undang undang sehat pasti ada kerjasama sektor publik swasta sedia layan sehat undangundang,Netral,,,
1.75E+18,undang undang sehat upaya pasti ada regulasi dukung kendali iklan produk farmasi tegakkanhukum,Netral,,,
1.75E+18,moga undang undang tenaga sehat nomor tahun revisi farmasi bisa str,Netral,,,
1.74E+18,landas hukum larang topeng monyet di kitab undang undang hukum pidana kuhp pasal atur tindak siksa hewan juga atur undang undang nomor tahun terna sehat pasal ayat,Negatif,,,
1.74E+18,apoteker kemarin bapak ulas kilas kena undang undang farmasi lho bapak undang undang sehat farmasi,Netral,,,
1.74E+18,undang undang sehat dorong ada akses lebih mudah layan sehat kualitas tegakkanhukum,Positif,,,
1.74E+18,lalu undang undang sehat perintah upaya ada program kendali infeksi nosokomial,Netral,,,
1.74E+18,jelas kendali tembakau rancang atur perintah undang undang sehat kuat khawatir timbul genosida selubung generasi muda bangsa nanti generasi muda jadi generasi sakit sakit rokokabnormal,Negatif,,,
1.74E+18,dasar pasal undang undang nomor tahun sehat pasti tindak bedah laku sesuai norma agama norma sosial budaya norma susila etika profesi itu kadaver larang potret,Positif,,,
1.74E+18,kemudian baru terbit undang undang nomor tahun sehat pasal ayat huruf bunyi didik teliti tunjang giat layan transplantasi organ atau jaring tubuh,Positif,,,
1.74E+18,guna kadaver atur undang undang nomor tahun sehat bagi delap belas bedah mayat pasal ayat con,Netral,,,
1.74E+18,terap undang undang sehat cipta landas kendali edar obat obat ilegal undangundang,Negatif,,,
1.74E+18,terap undang undang sehat upaya pasti ada bijak dukung sedia obat jangkau kpkri,Netral,,,
1.74E+18,ijin tanya maaf sepenuh ngerti perihal bpjstk sehat kalau biaya potong gaji pegawai tentu bukan masuk benefit kantor kalau undang undang sedia kerja wajib daftar pegawai atau bayar,Negatif,,,
1.74E+18,duga laku kena undang undang nomor tahun terna sehat hewan duga laku akan sangka pasal kuhp jual tawar serah bagi barang tahu bahaya nyawa sehat,Negatif,,,
1.74E+18,beban pandemi jadi tanggung jawab perintah rupa amanat undang undang jamin sehat rakyat,Netral,,,
1.74E+18,masyarakat polda jateng kombes pol iskandar fitriana sutisna kata angkut hewan sebut langgar undang undang sehat hewan laku jerat pasal ayat uu sehat hewan ancam hukum penjara,Netral,,,
1.74E+18,pasal angka undang undang nomor tahun pangan undang undang nomor tahun ubah atas undang undang nomor tahun terna sehat hewan uu atur definisi ternak perda uu gugel noh,Netral,,,
1.74E+18,muara belit layan sehat rupa salah satu hak wajib beri warga bina masyarakat wbp lama jalan masa pidana ini amanat undang undang nomor tahun masyarakat cantum bab ii,Negatif,,,
1.74E+18,douma benar kamu jawab tanya orang waras mana kasihan laku kriminal perkara makan even undang undang atur kalau napi hak sehat makan layak turut kamu undang undang pp ngatur soal makan napi aneh siap paling aneh,Negatif,,,
1.74E+18,walah lupa tugas undang undang sehat manajemen apotek lupa kerjain saking fokus pkl proposal,Netral,,,
1.74E+18,pasti penuh hak makan warga bina sesuai amanat undang undang nomor tahun masyarakat pasal poin bunyi narapidana hak dapat layan sehat makan layak sesuai butuh gizi,Positif,,,
1.74E+18,lalu undang undang sehat perintah dorong kembang sistem beri izin regulasi sehat undangun,Netral,,,
1.74E+18,menteri tani tan andi amran sulaiman perintah jajar cepat revisi undang undang uu terna sehat hewan serta turun simak berita lengkap klik link dibio panennews,Positif,,,
1.74E+18,undang undang sehat upaya pasti ada awas aman produk medis farmasi undangundang,Netral,,,
1.74E+18,hal sanksi pidana khusus subjek hukum tenaga sehat laku malpractice medis medical practice dasar pasal ayat undang undang nomor tahun sehat atur pidana pokok upa penjara paling lama tahun denda,Positif,,,
1.74E+18,palembang undang undang sebut klasifikasi atur klasifikasi obat zat uu tahun menteri sehat terbit ubah klasifikasi obat narkotika,Netral,,,
1.74E+18,ran sehat lanjut usia pres nomor strategi nasional kelanjutusiaan undang undang sehat nomor program sehat lanjut usia tuju tingkat kualitas hidup lansia sehat mandiri,Positif,,,
1.74E+18,ada produksi nila nyawa jadi ratus kerja lapor laku protes rabu ancam laku aksi mogok kerja apabila tuntuntannya usaha patuh undang undang sehat selamat kerja,Positif,,,
1.74E+18,tanam kratom ini tetap undang undang atur atur menteri sehat barang narkotika jenis narkotika lain meski bnn garut laku upaya cegah barang sinyalir kandung narkotika tidak,Negatif,,,
1.74E+18,sahabatpp ditjen pp selenggara rapat siap harmonisasi bulat mantap konsepsi rancang atur perintah laksana undang undang nomor tahun sehat,Positif,,,
1.74E+18,tiap orang punya hak oleh layan sehat aman mutu jangkau sesuai amanat undang undang sehat babel kumhambabel harunsulianto lppangkalpinang,Positif,,,
1.74E+18,undang undang sehat upaya pasti ada program vaksinasi rata lindung sehat masyarakat,Netral,,,
1.74E+18,undang undang buat lindung mega proyek apbn guna dana padahal bangun indonesia rata didik sehat pernah peduli rezim hutang negara tumpuk,Netral,,,
1.74E+18,iya undang undang sehat jadi nomor tahun atur belanja wajib sehat mandatory spending resmi hapus atur tegas anggar sehat atur sesuai butuh negeri,Netral,,,
1.74E+18,undang undang sehat upaya pasti ada program kendali sakit tular lalu kampanye sehat undangundang,Netral,,,
1.74E+18,paling sedikit apbn didik apbn sehat undang undang uud ubah lantas bagaimana uu sehat oleng bos,Positif,,,
1.74E+18,undang undang sehat atur upaya kendali obat obat produk sehat pasti aman und,Netral,,,
1.74E+18,yakin ada larang jelas undang undang nomor tahun terna sehat hewan sebut kalau anjing bukan hewan ternak tak jadi bahan pangan,Positif,,,
1.74E+18,secret marah marah jelas padahal isi undang undang tidak larang makan anjing atur sehat hewan cara ternak hewan konsumsi tanya data malah marah marah orang dungu cermin,Negatif,,,
1.74E+18,moga tahu mana rumah potong daging ilegal indonesia sesuai pasal angka undang undang nomor tahun pangan bagi surat edar direktorat jenderal terna sehat hewan menteri tani nomor,Negatif,,,
1.74E+18,lalu undang undang sehat perintah upaya pantau awas kualitas pangan kpkri,Netral,,,
1.74E+18,undang undang sehat atur lindung hak hak pasien aspek privasi undangundang,Netral,,,
1.74E+18,indonesia milik konsumsi miras milik batas ketat sejak undang undang nomor tahun pangan uu nomor tahun sehat atur larang jual produksi distribusi konsumsi minum keras tempat umum,Negatif,,,
1.74E+18,perintah sedang susun rancang atur perintah rpp laksana undang undang nomor tahun sehat,Netral,,,
1.74E+18,layan sehat bagai bukti komitmen jajar lapas indramayu upaya jamin penuh hak sehat warga bina bagaimana amanat undang undang nomor tahun masyarakat kemenkumham jabar andika dwi prasetya,Netral,,,
1.74E+18,undang undang sehat nomor tahun pasal ayat beri asi tempat umum ibu sedang susu lindung hak beri asi di mana dan kapan bayi butuh ganggu halang beri asi pidana,Positif,,,
1.74E+18,dinas sehat kab minahasa selatan atas nama dakwa ffm agenda periksa saksi hadir banyak saksi dakwa dakwa langgar pasal ayat pasal jo pasal undang undang nomor tahun,Positif,,,
1.74E+18,undang undang sehat atur lindung hak hak sandang disabilitas layan sehat tegakkanhukum,Netral,,,
1.74E+18,baca undang undang sehat nomor tahun pasal ayat beri asi tempat umum ibu sedang susu lindung hak beri asi di mana dan kapan bayi butuh lepas itu edukasi bukan,Positif,,,
1.74E+18,orang hak oleh layan sehat sobat pers orang hak oleh layan sehat yang sebut undang undang yuk simak postingan,Netral,,,
1.74E+18,handicapnya lama pdip banyak dukung undang undang asal kebut problematik omnibus law uu sehat uu kpk uu ikn uu berantas tipikor terus rasa pepes kosong,Positif,,,
1.74E+18,cuma satu contoh uu ikn omnibus uang omnibus sehat bahkan uu ppp kebiri partisipasi masyarakat undang undang undang undang tuju nasdem pkb,Netral,,,
1.74E+18,waelah bang ngeliat begini mirip ngeliat undang undang mirip bakal ubah dasar negara noh kamu baca uu omnibus law uu kpk uu ikn uu omnibus sehat benar ikat kalau laku negara sah eksekusi warga tidak jalan,Positif,,,
1.74E+18,ringkas terima kasih bapak berani angkat materi bahas soal tragedi kamu kanjuruhan respect jangan lupa bapak bagaimana undang undang omnibus law sehat video lengkap,Positif,,,
1.73E+18,standar syarat kompetensi teknis laboratorium uji kalibrasi sistem manajemen sehat selamat kerja iso standar layan publik sesuai undang undang nomor tahun,Netral,,,
1.73E+18,jelas evidence based sekarang rasio dosen mahasiswa kurang jauh didik sehat hak azasi atur undang undang perlu campur tangan negara kait penuh biaya,Positif,,,
1.73E+18,yang habis baca ipe ipc etika undang undang farmasi layan sehat alias bapak bapak,Netral,,,
1.73E+18,butuh undang undang benar benar lindung sehat bukan malah boleh bahaya republik indonesia rokokabnormal sebatbikinrungkad,Positif,,,
1.73E+18,undang undang nomor tahun karantina hewan ikan tumbuh langkah langkah periksa perlu upaya cegah kendali sakit hewan dapat dampak negatif sehat masyarakat,Negatif,,,
1.73E+18,lalu undang undang sehat perintah komitmen mel,Netral,,,
1.73E+18,topeng monyet larang perintah provinsi dki jakarta sejak tahun lantar langgar kuhp nomor atur siksa hewan atur tan nomor tahun sehat masyarakat veteriner sejahtera hewan undang undang nomor,Negatif,,,
1.73E+18,undang undang sehat dukung upaya promosi sehat ibu anak kurang angka mati ibu bayi tegakkanh,Netral,,,
1.73E+18,kabar revisi undang undang komisi berantas korupsi kpk omnibus law cipta kerja lagi uu minerba omnibus law sehat lain,Negatif,,,
1.73E+18,undang undang tebar nyeleneh salah satu uu sehat konon langgar konstitusi rokokabnormal sebatbikinrungkad,Negatif,,,
1.73E+18,sesuai undang undang nomor tahun atur layan sehat warga bina poliklinik rutan cirebon upaya ikan layan prima kemenkumhamjabar randikadwiprasetya,Netral,,,
1.73E+18,ungsi rohingya lebih harga nenek ke mana mana jamin penuh hak atas awat sehat masyarakat yang tuang undang undang hanya omong kosong belaka,Negatif,,,
1.73E+18,politik salah satu aye chan cek tweet pertama pic kesah undang undang kewarganegaraan tuju sangkal hak kewarganegaraan etnis rohingya samping batas akses trhdp didik kerja sehat praktik agama scara bebas lain,Positif,,,
1.73E+18,awat sehat tiap warga bina rupa amanah undang undang masyarakat ujar kepala lapas banyuwangi agus wahono jatimnow lapasbanyuwangi senam wargabinaan,Netral,,,
1.73E+18,selenggara registrasi tenaga medis tenaga sehat acu tentu pasal dengan pasal pasal undang undang nomor tahun sehat arti pola pola prasyarat registrasi lama tinggal,Positif,,,
1.73E+18,undang undang nomor tahun sehat beri solusi atas soal utama layan sehat juta rakyat serta jkn kelas artikelopini adadikompas,Positif,,,
1.73E+18,terap undang undang sehat cipta landas upaya pantau nilai aman produk sehat kpkri,Netral,,,
1.73E+18,memang sehat adalah yang fundamental masing paslon punya cara kerja sendiri asal jangan kutak atik undang undang,Netral,,,
1.73E+18,negrancang undang undang harus banyak libat kok tidak dpr tidak hayo kasihan kerja tani tembakau deh memang paling benet tolak pasal rpp uu sehat tembakaudizolimi republik indonesia,Positif,,,
1.73E+18,iya ajar pasal undang undang sehat rumah sakit sudah banyak sekali buku ini adik baca hafal semua tantang hukum,Negatif,,,
1.73E+18,jejak rekam sikap oposisi pks lihat banyak bahas bijak ambil perintah sangkut naik harga bahan bakar minyak bijak impor pangan tolak undang undang cipta kerja uu ibu kota negara uu sehat pkspembelarakyat,Positif,,,
1.73E+18,hak beri suara milu disabilitas lindung undang undang dasar undang undang hak asasi manusia undang undang sehat undang undang kesah konvensi kena hak hak sandang disabilitas,Netral,,,
1.73E+18,hai sesuai pasal pp bkp tentu sifat strategis atas serah bebas kena ppn liput pakan ternak bagaimana atur undang undang bidang terna sehat hewan masuk pakan hewan sayang,Positif,,,
1.73E+18,aborsi marak laku ini bukan dasar atur sesuai undang undang sehat laku simpang atur sebut aborsi jadi lepas gaul remaja ini sangat prihatin karena banyak remaja,Positif,,,
1.73E+18,undang undang cabut perppu batal ikn alih anggar didik sehat perata adil fasilitas didik sehat lebih urgent,Positif,,,
1.73E+18,doktif ikan jelas pasal pasal undang undang sehat sangat bahaya implementasi pandemic treaty uji coba nyamuk circle doktif alias teman main diskusi jendral syamsir siregar prof din syamsuddin prof anthony budiawan,Negatif,,,
1.73E+18,ada leher miring mata juling rupa buah kriteria sehat hal test sehat negeri konoha arti harus sehat jadi cawapres sana bahkan perlu undang undang konstitusi kalau buat sang putra mahkota,Positif,,,
1.73E+18,dalam paperbag sebut tiga jenis buku diri atas undang undang cara jadi manusia baik buku siksa neraka beda beli arjuna kemarin ada juga usb risi pdf epub bagai buku sehat mental yang dia download,Positif,,,
1.73E+18,karena turut edy jangan draft rancang atur perintah pp turun undang undang uu nomor sehat rpp sehat buat bagai dampak saat sudah baik justru jadi buruk,Positif,,,
1.73E+18,menteri uang kemenkeu buka suara soal atur baru upa rancang atur perintah rpp turun undang undang uu nomor sehat rpp sehat,Positif,,,
1.73E+18,kopi arang kopi joss belakang jadi populer internet tarik banyak orang coba menteri sehat malaysia kkm ingat praktik kopi macam langgar undang undang dapat tuntut adil,Positif,,,
1.73E+18,muhammad rizal dpr republik indonesia gandeng kemenkes sosialisasi undang undang sehat sama mahasiswa tangerang,Netral,,,
1.73E+18,tahu penting generasi muda ikut partisipasi milu pilih wakil rakyat jujur baik profesional bisa juang undang undang lindung guru tenaga sehat bagai wakil rakyat sejati panjang suara rakyat,Positif,,,
1.73E+18,selamat siang sobat intress pasal ayat undang undang dasar tahun atur tiap orang hak hidup sejahtera lahir batin tempat tinggal dapat lingkung hidup baik sehat hak oleh layan sehat,Positif,,,
1.73E+18,akibat buat laku jerat undang undang republik indonesia nomor tahun sehat pasal pasal edar obat sedia farmasi izin,Netral,,,
1.73E+18,dasar hukum laksana hukum sehat ikut pasal ayat undang undang dasar negara republik indonesia tahun undang undang nomor tahun sehat undang undang nomor tahun praktik dokter,Netral,,,
1.73E+18,tuju sembuh sakit kurang derita akibat sakit bahkan kendali sakit ujar kalapas layan sehat lembaga masyarakat tuang undang undang nomor tahun pasal ayat huruf tentang masyarakat,Netral,,,
1.73E+18,tiga tahun sejak mohon uji materiil undang undang nomor tahun narkotika kait guna ganja medis perlu sehat aju hasil tahun tolak mohon sebut,Netral,,,
1.73E+18,atur larang iklan sponsorship rokok rancang atur perintah rpp sehat produk turun undang undang sehat tahun mediadigitalcpp indotvlive rokok laranganrokok rpp,Netral,,,
