1.75E+18,seram perintah sekarang buat rpp uu sehat buru buru sekali gatau yang kejar harus tolak pasal tembakau rpp uu sehat republik indonesia tolakpasaltembakaurppkesehatan,Netral,,,
1.75E+18,yuk dong perintah pimpin negara solutif ini jelas ngerugiin harus tolak pasal tembakau rpp uu sehat republik indonesia tolakpasaltembakaurppkesehatan,Netral,,,
1.75E+18,tembakau sudah jadi bagi masyarakat adat tiba tiba larang saja tolak pasal tembakau rpp uu sehat republik indonesia tolakpasaltembakaurppkesehatan,Netral,,,
1.75E+18,jangan semena mena larang produksi tembakau sudah jadi bagi masyarakat adat baik revisi pasal tembakau rpp uu sehat republik indonesia tolakpasaltembakaurppkesehatan,Positif,,NET,342
1.75E+18,tuju kata bapak jangan atur buat untuk untung bagi pihak baik tolak pasal tembakau rpp uu sehat republik indonesia tolakpasaltembakaurppkesehatan,Negatif,,,342
1.75E+18,dulu dagang tolak pasal tembakau rpp uu sehat karena kalau ada solusi dari masalah gimana jual gimana dapat duit buat makan tolakpasaltembakaurppkesehatan republik indonesia,Positif,,POS,642
1.75E+18,tembakau bagi masyarakat adat tuju sekali bapak pasal tembakau rpp uu sehat perlu sekali tinjau ulang rugi banyak pihak republik indonesia tolakpasaltembakaurppkesehatan,Positif,,NEG,198
1.75E+18,gin ya rakyat kecil hasil jual asong berapa juga ancam usaha tolak pasal tembakau rpp uu sehat tolakpasaltembakaurppkesehatan republik indonesia,Negatif,,,
1.75E+18,tolak pasal tembakau rpp uu sehat benar main untung pihak tentu republik indonesia tolakpasaltembakaurppkesehatan,Positif,,,1182
1.75E+18,tembakau jadi bagi masyarakat adat turun turun dulu ada masalah baru sekarang saja tolak pasal tembakau rpp uu sehat republik indonesia tolakpasaltembakaurppkesehatan,Positif,,,
1.75E+18,tuju bapak jangan regulasi buat untung main rugi lain tolak pasal tembakau rpp uu sehat republik indonesia tolakpasaltembakaurppkesehatan,Negatif,,,
1.75E+18,rpp uu sehat beri dampak negatif sangat apalagi buat rakyat kecil sehrsnya perintah kasih solusi baik kait dampak beri tolakpasaltembakaurppkesehatan republik indonesia,Positif,,,
1.75E+18,tuju bapak buat atur jangan semena dong rugi masyarakat adat pasal tembakau rpp uu sehat sekali tinjau ulang rugi banyak pihak republik indonesia tolakpasaltembakaurppkesehatan,Positif,,,
1.75E+18,usul tolak pasal tembakau rpp uu sehat ketemu solusi usaha buat gantung nasih tidak tolakpasaltembakaurppkesehatan republik indonesia,Netral,,,
1.75E+18,bapak tidak tuju pasal tembakau rpp uu sehat republik indonesia tolakpasaltembakaurppkesehatan,Netral,,,
1.75E+18,parah kalau rpp uu sehat sah makanya tolak sangat deh soal kesah uu bikin rugi tolakpasaltembakaurppkesehatan republik indonesia,Positif,,,
1.75E+18,nah dengar kata bapak suruh buat tinjau memang paling benar tolak pasal tembakau rpp uu sehat republik indonesia tolakpasaltembakaurppkesehatan,Positif,,,
1.75E+18,perintah hrsnya kasih solusi rakyat kecil usaha sampai kalau rpp uu sehat sah tolakpasaltembakaurppkesehatan republik indonesia,Netral,,,
1.75E+18,kalau dirugiin kalang atas masih punya cara buat tahan hidup lha kalau rakyat kecil tolak pasal tembakau rpp uu sehat gin nasib gimana tolakpasaltembakaurppkesehatan republik indonesia,Negatif,,,
1.75E+18,bahkan pkl kena lho gara gara rpp uu sehat bukan cuma rugi usaha bisa rugi negara juag tolakpasaltembakaurppkesehatan republik indonesia,Netral,,,
1.75E+18,idha uu sehat sebut uu sesat apa bapak,Netral,,,
1.75E+18,linkaja indonesia ingat sobat linkaja selalu lindung data pribadi data lengkap diri keluarga data sehat uang biometrik lain paham hak atas data pribadi lindung uu nomor tahun lindung data pribadi,Negatif,,,
1.75E+18,tanya para buat uu dpr ini ada syarat sehat nikah uu arti syarat sehat mana langgar konstitusi konstitusi dasar negara dapat soal manfaat sesuatu arti,Netral,,,
1.75E+18,meruru fess liat kondisi sehat bapak prabowo jadi gibran akhir nyetir bapak prabowo rencana uu dkj bentar sah,Netral,,,
1.75E+18,sewa rahim haram kalau kalian muslim haram mutlak jelas ps uu nomor sehat sebut sewa sewa titip rahim hukum dapat laku indonesia rentan eksploitasi simpul poligami adopsi sila pilih,Negatif,,,
1.75E+18,gelar sidang lanjut perkara nomor puu xxi uji formil uu sehat senin mohon aju sekretariat sama sekber organisasi profesi sehat agenda sidang hari yakni dengar terang orang saksi,Positif,,,
1.75E+18,beberapa contoh bijak kendali konsumsi rokok milik potensi intervensi industri rokok batal indonesia ratifikasi framework convention on tobacco control tahun kasus pasal kena zat adiktif hilang uu sehat,Netral,,,
1.75E+18,thank uu kakak jaga sehat,Positif,,,
1.75E+18,izin nambahin surogasi larang laksana per lalu uu sehat baru metode fertilisasi buat larang metode bayi tabung regulasi khusus memang masih ada banyak celah,Positif,,,
1.75E+18,thank uu sudah lebih baik sie kamu jaga sehat yh,Positif,,,
1.75E+18,kalau pribadi dok anda masuk putar smbik tunggu hasil ulama turut politik dinamis saya tekan keluarga sekarang cari caleg partai masih konsisten juang nasib rakyat entah uu sehat omnibus law ikn lain,Negatif,,,
1.75E+18,ingin mohon instansi tempat lamar kerja ungkap daftar nama kombinasi kualifikasi minimal kait sehat bagaimana posita mohon arah langgar tentu uu lindung data pribadi uu pdp,Negatif,,,
1.75E+18,tuju memang betul dampak banyak sekali tolak pasal tembakau rpp uu sehat tolakpasaltembakaurppkesehatan republik indonesia,Positif,,,
1.75E+18,partai pks parga lurus selalu tetap konsisten bawa adil sll oposisi kebijkn tidak pro rakyat uu ciptaker tolak uu sehat tolak banyak skli yang oposisi cuma saja mau selalu kalah,Positif,,,
1.75E+18,alas dukung bapak prabowo pilpres baik putar pertama maupun putar dua alas saya tidak akan dukung paslon akan lanjut uu sehat omnibuslaw potensi bahaya selamat pasien daulat negara,Negatif,,,
1.75E+18,teliti fokus reformasi jamin sehat sosial cakup bentuk sistem jamin sosial nasional uu jamin sosial nasional hingga terap jamin sehat nasional jkn,Positif,,,
1.75E+18,jelas banyak tolak pasal tembakau rpp uu sehat tolakpasaltembakaurppkesehatan terus terima negara bakal kurang banyak apa resiko jangan tumpah rakyat kecil dong republik indonesia,Positif,,,
1.75E+18,sampai januari selesai soal tolak pasal tembakau rpp uu sehat temu titik terang loh sia sia sekali tolakpasaltembakaurppkesehatan republik indonesia,Positif,,,
1.75E+18,harus tinjau soal tani dagang rugi ada atur sudah kita tolak pasal tembakau rpp uu sehat republik indonesia tolakpasaltembakaurppkesehatan,Netral,,,
1.75E+18,dampak main main ini rugi negara tolak pasal tembakau rpp uu sehat republik indonesia tolakpasaltembakaurppkesehatan,Netral,,,
1.75E+18,sekarang kena rugi atur para dagang tani saja besok negara rugi sudah harus tolak pasal tembakau rpp uu sehat republik indonesia tolakpasaltembakaurppkesehatan,Netral,,,
1.75E+18,mulai tani dagang rugi ada atur sudah kita tolak pasal tembakau rpp uu sehat republik indonesia tolakpasaltembakaurppkesehatan,Netral,,,
1.75E+18,bahaya sekali sih kalau buat atur rugi negara tolak deh pasal tembakau rpp uu sehat republik indonesia tolakpasaltembakaurppkesehatan,Netral,,,
1.75E+18,kalau beda jualbeli organ transplantasi organ iya lah tuju kalau surogasi halus jasa gestasi jelas sesuai uu sehat jo bawa paling mungkin pakai selundup hukum surogasi luar negeri boleh lahir pindah sini,Positif,,,
1.75E+18,nah bisa buat rugi negara atur tahan haru tolak pasal tembakau rpp uu sehat lah republik indonesia tolakpasaltembakaurppkesehatan,Netral,,,
1.75E+18,pasal tembakau bahaya sekali dampak rugi banyak sektor tolak pasal tembakau rpp uu sehat republik indonesia tolakpasaltembakaurppkesehatan,Positif,,,
1.75E+18,moga dapat amat perintah lebih cepat revisi atur tolak pasal tembakau rpp uu sehat republik indonesia tolakpasaltembakaurppkesehatan,Positif,,,
1.75E+18,amat tuju kalau atur buat rugi tolak pasal tembakau rpp uu sehat republik indonesia tolakpasaltembakaurppkesehatan,Netral,,,
1.75E+18,hrsnya perintah pikir sih tembakau sendiri penting masyarakat adat masa ada uu sehat jadi hilang enggak cari solusi tolakpasaltembakaurppkesehatan republik indonesia,Positif,,,
1.75E+18,perintah bakal tolak pasal tembakau rpp uu sehat negara rugi banyak republik indonesia tolakpasaltembakaurppkesehatan,Positif,,,
1.75E+18,prof bilang kalau tembakau tidak hilang karena satu regulasi nah soal rpp uu sehat padahal rugi negara sangat kalau sah tolakpasaltembakaurppkesehatan republik indonesia,Positif,,,
1.75E+18,makanya tolak sangat rpp uu sehat tembakau bagai hidup masyarakat masa hilang padahal kalau sah bisa rugi negara tolakpasaltembakaurppkesehatan republik indonesia,Positif,,,
1.75E+18,banyak suara tolak pasal tembakau rpp uu sehat tolakpasaltembakaurppkesehatan masuk resiko rugi juga rakyat kecil gakbisa moga ada solusi republik indonesia,Positif,,,
1.75E+18,kangen sekali omg kamuu aku liat kemarin seperti ngeborong banyak sangat yaampun tinggal jaga sehat jangan lupa ce titip salam viana hehew lovv uu fionyjkt fionymail,Positif,,,
1.75E+18,prof mahmud tuh bakal juang sosl rpp uu sehat tembakau penting masyarakat adat hrsnya timbang bagi perintah tolakpasaltembakaurppkesehatan republik indonesia,Positif,,,
1.75E+18,tolak pasal tembakau rpp uu sehat tolakpasaltembakaurppkesehatan tidak cuma satu kalang tani industri kreatif bahkan terima negara kurang gin banyak republik indonesia,Positif,,,
1.75E+18,penasaran nasib orang tolak pasal tembakau rpp uu sehat tolakpasaltembakaurppkesehatan gantung nasib sama republik indonesia tahun hehe,Negatif,,,
1.75E+18,kalau pihak kait ada bisa pikir solusi masyarakat tolak pasal tembakau rpp uu sehat bisa bikin sayembara buat dipikirin tolakpasaltembakaurppkesehatan republik indonesia,Netral,,,
1.75E+18,betul bapak perlu yang hilang gimana republik indonesia justru harus aku tolak pasal tembakau rpp uu sehat tolakpasaltembakaurppkesehatan,Positif,,,
1.75E+18,banyak orang pintar prestasi kreatif indonesia yakin harus banyak pikir solusi masyarakat tolak pasal tembakau rpp uu sehat tolakpasaltembakaurppkesehatan republik indonesia,Positif,,,
1.75E+18,tahun januari pun hampir habis soal tolak pasal tembakau rpp uu sehat tolakpasaltembakaurppkesehatan hari belum titik terang gimana mau buang sia republik indonesia,Positif,,,
1.75E+18,uu cipta kerja buka peluang komersialisasi didik sehat makin mahal biaya didik sehat pksmenang kerjagampang,Negatif,,,
1.75E+18,turut soal tolak pasal tembakau rpp uu sehat tolakpasaltembakaurppkesehatan selesai di republik indonesia banyak orang pintar cari deh solusi bagaimana ni sia ekspor kek,Positif,,,
1.75E+18,dampak tenaga kerja sangat ancam dapat akibat sektor ekonomi tidak stabil fix tolak pasal tembakau rpp uu sehat republik indonesia tolakpasaltembakaurppkesehatan,Positif,,,
1.75E+18,di uu sehat implisit aku hormat segala jenis identitas seksual gender,Positif,,,
1.75E+18,tambah bapak anies kalau eksekutif janji mau revisi uu ite mbulet pas tanya omnibus law sehat cmiiw isu saya rasa sangat penting kapasitas pdip partai besar sangat pengaruh,Positif,,,
1.75E+18,patters kliatan tidak pernah nonton desak anies itu sering tanya jawab anies akan revisi uu cipta kerja uu sehat uu kpk ikn,Netral,,,
1.75E+18,laksono uu karantina sehat ketok,Netral,,,
1.75E+18,butuh uu tahan keluarga too private dibutuhin uu jamin perata didik sehat bangun infrastruktur,Netral,,,
1.75E+18,thankk uu kamuu jaga sehat yahh pancaroba nih soal,Netral,,,
1.75E+18,perintah lalu menteri sehat kemenkes tengah rancang draf rancang atur perintah turun undang undang uu nomor tahu,Netral,,,
1.75E+18,mas konsisten tolak uu sehat omnibuslaw dumdum republik indonesia anakkolong gsp,Netral,,,
1.75E+18,periksa sehat ratifikasi uu sehat memang masuk uu kawin tulis anda sebut islam dalam islam justru sunnahkan cari pasang sehat subur bagaimana tahu sehat subur periksa,Positif,,,
1.75E+18,kabarr akuu baikkk hari hari saja kurang baikk juga sukaa sama negeri jepang mungkin suatu saya ke sana senang senang btw tetap jaga sehat kamuu dell terima kasih jugaa pap dijepang nyaa luvv uu lt jawabdel adeljkt,Positif,,,
1.75E+18,aspek prosedural formal bagaimana laku bentuk uu sehat rupa bentuk bijak tokenistik semata mata tuju hadir partisipasi fisik hirau partisipasi gagas mengawalkonstitusi salamkonstitusi mkri,Netral,,,
1.75E+18,gelar sidang lanjut perkara nomor puu xxi ihwal uji formil uu sehat kamis mohon aju sekretariat sama sekber organisasi profesi sehat,Netral,,,
1.75E+18,manusia dulu manusia kasih hak rakyat sesuai uu kasih didik baik sehat buka lapang kerja sluas laku koruptor binatang rampas aset koruptor bicara hewan rakyat ada harap bansos,Positif,,,
1.75E+18,okayy jaga sehat kaa nice to know uu,Netral,,,
1.75E+18,omnibus law uu sehat yang buru buru ada urgensi apa wajib curiga,Netral,,,
1.75E+18,tiba tiba sudah sah hal uu sehat tiba sah rapat tutup terus saya gatau saja bahas dalam tidak sedia lapor hasil rapat,Negatif,,,
1.75E+18,ingat selalu lindung data pribadi data diri keluarga data sehat biometrik lain paham hak atas data pribadi lindung uu nomor tahun lindung data pribadi yuk guna media sosial lebih waspada cermat,Positif,,,
1.75E+18,hai rin thank uu much mau mootsku yahh yuk bisa lebih akrab jbjb lebih buanyak moga beri bahagia sehat selalu moga lancar segala urus cepat ketemu ichan saya konser lanjut xixi,Positif,,,
1.75E+18,kansil uu sehat jiwa dibutuhkn peran masy mmbantu odgj kmbali produktif problem semua msy mnyesuaikn diri interaksi ex odgj minim pmahaman kwalifikasi kesembuhn odgj sebut empati masy mmbantu wujud tngkat ksembuhan odgj diberitahu level mana,Negatif,,,
1.75E+18,eks dirut rs sesat beri jelas beda layan pasien bpjs mandiri boleh semua wajib laku uu nomor rumah sakit atur bpjs sehat nomor selenggara jamin sehat pasal kuhperdata,Negatif,,,
1.75E+18,cipeng entah bagaimana pandang itu dok padahal nyata punya oemimpin tidak bicara efek sekarang tiba bijak omnibuslaw ruu sehat uu minerba sosialisasi langsung teken jalan rugi siapa kalau bukan rakyat,Positif,,,
1.75E+18,fess kan memang dalam uu sehat baru,Positif,,,
1.75E+18,koko gimana dampak uu omnibus law sehat dok,Netral,,,
1.75E+18,rumus ken didik jangkau peluang kerja luas vote tuju uu tpks vote nasdem pkb yang inisiasi bang tobas nasdem bu luluk pkb tuju revisi uu kpk omnibus cipateker sehat vote pks yang tolak teguh oposisi pks,Positif,,,
1.75E+18,betul sedang susun skripsi kait uu sehat baru kalau tahu jelas pasal berapa dalam uu nomor tahun terima kasih,Positif,,,
1.75E+18,fess puluh tahun reformasi baru capres concern sehat mental misi ini luar biasa saya milik saudara kandung ponakan sakit jiwa ada uu mampu cegah orang warga derita ganggu jiwa tindak tepat,Negatif,,,
1.75E+18,selamatt malam sayang cintakuu manis cantikuu raishajkt calliejkt mbok jamu baca berita cuma kamu saya cinta heheww semangatt terus shengkuu semua member jangan lupa jaga sehat selalu luvv uu pajamadrivejkt,Positif,,,
1.75E+18,florajkt gapapaa kamu baru kabar sekarang penting kamu jaga sehat selalu luv uu,Positif,,,
1.75E+18,happiest birthday for uu moga kamu kamu beri sehat umur panjang rezeki lancar limpah banyakkk bahagia lancar segala urus moga kamu lolos ptn impi kamu aamiin tetap semangattt yaaa,Positif,,,
1.75E+18,di bidang jasa lokasi surabaya barat thp lumayan beasiswa buat anak pinjam bunga rendah sk pegawai karena uu tidak lagi tahun bpjs sehat program jamsostek ikut semua dana pensiun cuti dada bonus tahun thr,Positif,,,
1.75E+18,fess lagi atur kodeki juga uu sehat tidak menyebarluaskan diagnosa pasien izin pasien wali orangtua tanggung jawab atas pasien,Positif,,,
1.75E+18,perata gimana maksud misal tenaga sehat realistis bakal tahun capai didik mungkin apa yang rata kalau rata dalam tahun arti kerja kerja padahal masuk uu,Positif,,,
1.75E+18,fess fyi anies baswedan serta konvensi capres demokrat salah satu proposal wujud jamin sehat semesta bpjs betul presiden jokowi amanat uu bpjs laksana kalau itu presiden anies mungkin sistem,Negatif,,,
1.75E+18,dampak rugi uu omnibus sehat apa dok,Netral,,,
1.75E+18,jangan lupa uu omnibus sehat sampai sekarang mas minim bahas atur laksana hampir semua subbidang sehat,Negatif,,,
1.75E+18,memang bisa ngapain nder red flagnya lama uu kpk omnibus law ruu sehat lain toh tetap jalan kita bisa ngapain pulang cuma demo habis yaudah lupa makanya ngelunjak mirip gin,Positif,,,
1.75E+18,fess iya soal sehat benar gantung sekali pemda kalau pemda peduli soal sehat pure bukan ousat pimpin memang paham prioritas di uu sehat baru mandatory spending hapus bahkan masyarakat hari nikmat pbi,Positif,,,
1.75E+18,benar kalau nyalahin nyalahin kpu uu kasih syarat sehat calon presiden terlalu longgar semua capres tes rata uu atur ada dia mampu sehat pimpin negara tahun depan flawed rules but is what,Positif,,,
1.75E+18,soal campaign desak anies program jaki benar benar dengar suara rakyat lama sekali rasa rakyat bisa suara mulai uu ite cipta kerja ruu sehat putus soal cawapres gede apa tolak tetap sah,Positif,,,
1.75E+18,fess coba jelas mama uu sehat omnibus law uu nomor tahun urai problem baca,Netral,,,
1.75E+18,kalau uu milu atur guna fasilitas negara lekat jabat presiden wakil presiden sangkut aman sehat protokoler laku sesuai kondisi lapang profesional proporsional cuti kampanye,Positif,,,
1.75E+18,uu tahun jelas sampai pasal presiden wakil presiden punya hak laksana kampanye kata anak ikut nyawapres rupa paslon nyata fakta kondisi sehat wowo bagus paham,Positif,,,
1.75E+18,sekarang ada di uu sehat baru tinggal pasti saat cpns ada formasi ahli sehat masyarakat kalau ada tahu sudah nasib di kemenkes turun saing sarjana,Positif,,,
1.75E+18,semangat giat aderuu adeljkt have fun jepangnya jaga sehat yaw jaga pola makan pola tidur penting sangat buat sehat luv uu semangat,Positif,,,
1.75E+18,kalau untung kek uu karantina sehat langsung teken malam juga chuasaaakkss,Positif,,,
1.75E+18,uu konstitusi terobos apalagi tes sehat aowkwowkwowkowk,Netral,,,
1.75E+18,sd smp gratis sehat gratis pupuk murah stock limpah maksimal hasil tani kebun lain sehingga jadi produk ekspor unggul indonesia pemuda bangga tani uu ampas aset miskin koruptor smp turun,Positif,,,
1.75E+18,uu sehat memang momok buruk sangat buat nakes dokter pendiem ikut demo,Negatif,,,
1.75E+18,lelah lelah kuliah fk jadi koas gatidur uji jaga malah pilih mayoritas parpol susung uu sehat hilang idi iya dokter asing masuk indo benar ajee rugi dong,Negatif,,,
1.75E+18,uu di utak atik rejim kek uu uu omnibus uu sehat lain,Negatif,,,
1.75E+18,mohon gaji sejahtera dokter nakes atur lebih jelas tegas uu sehat bapak bukan sistem bpjs sejahtera bpjs para dokter tenaga medis harus atur jelas uu bukan lain,Positif,,,
1.75E+18,kak gitajkt giat saja hari ini banyak jangan lupa selalu jaga sehat yahh btw ken sangat cerita kak gitajkt apa tetapi halang love uu kakak,Positif,,,
1.75E+18,naaah ini saya baca uu omnibus law sehat rs ilegal curi organ pasien koma,Negatif,,,
1.75E+18,bantu rakyat tolak rpp uu sehat kita tolak pasal tembakau rpp uu sehat republik indonesia tolakpasaltembakaurppkesehatan,Netral,,,
1.75E+18,bapak hormat kasih solusi kalau sangat rugi rakyat harus tolak pasal tembakau rpp uu sehat republik indonesia tolakpasaltembakaurppkesehatan,Positif,,,
1.75E+18,benar sekali bapak memang baik pasal tembakau rpp uu sehat tinjau karena rugi banyak pihak republik indonesia tolakpasaltembakaurppkesehatan,Positif,,,
1.75E+18,bapak suruh buat tinjau pasal tembakau rpp uu sehat karena rugi tani dagang republik indonesia tolakpasaltembakaurppkesehatan,Netral,,,
1.75E+18,atuhlah para tenaga kerja dagang kena dampak bijak kita tolak pasal tembakau rpp uu sehat republik indonesia tolakpasaltembakaurppkesehatan,Netral,,,
1.75E+18,bapak tidak tuju dengan pasal tembakau rpp uu sehat memang dampak rugi banyak pihak republik indonesia tolakpasaltembakaurppkesehatan,Positif,,,
1.75E+18,punya kuasa sikap adil bijak buat bijak harus tolak pasal tembakau rpp uu sehat republik indonesia tolakpasaltembakaurppkesehatan,Positif,,,
1.75E+18,kata prof juga harus tinjau nih soal pasal rpp uu sehat tembakau hidup masyarakat adat bisa henti cuma satu regulasi tolakpasaltembakaurppkesehatan republik indonesia,Netral,,,
1.75E+18,keren lho prof mau ikut juang buat tinjau soal rpp uu sehat ada mau hidup masyarakat adat malah diilangin tolakpasaltembakaurppkesehatan republik indonesia,Positif,,,
1.75E+18,kalau gin memang harus tinjau dong masa hilang hidup masyarakat adat saja tolak sangat rpp uu sehat tolakpasaltembakaurppkesehatan republik indonesia,Positif,,,
1.75E+18,kata prof hrsnya di tinjau apalagi bisa mati karena satu regulasi tolak sangat pasal rpp uu sehat kalau ujung ujung malah rugiin negara tolakpasaltembakaurppkesehatan republik indonesia,Positif,,,
1.75E+18,smgggttt kaiii tetap jaga sehat yaahh love uu,Positif,,,
1.75E+18,flm flamingo decentralized finance defi defi bank beda kalau bank kantor awas ojk karyawannya lindung uu defi balik defi ada kantor semua laku bank defi bisa juga asuransi sehat lain,Negatif,,,
1.75E+18,bapak harus hapus pasal tembakau rpp uu sehat dampak ekonomi terlalu besar rakyat kerja sektor iht republik indonesia juga tolakpasaltembakaurppkesehatan,Netral,,,
1.75E+18,pasal tembakau rpp uu sehat rugi rakyat sekali harus tolak begitu paksa pasal sebut mungkin republik indonesia bisa kasih masuk bapak tolakpasaltembakaurppkesehatan,Positif,,,
1.75E+18,bapak republik indonesia pasal tembakau rpp uu sehat harus sekali tolak karena lebih banyak rugi rakyat tolakpasaltembakaurppkesehatan,Positif,,,
1.75E+18,bapak masak yang rugi negara ratus triliun biar sihh plislah hapus pasal tembakau rpp uu sehat bapak tolakpasaltembakaurppkesehatan,Netral,,,
1.75E+18,bapak kalau peduli rakyat kerja tani tembakau kerja pabrik iht bilangin buat keluar pasal tembakau rpp uu sehat bantu bapak tolakpasaltembakaurppkesehatan,Netral,,,
1.75E+18,rpp uu sehat harus telaah belum sah ujung negara yang rugi tolakpasaltembakaurppkesehatan republik indonesia,Netral,,,
1.75E+18,susah jadi rakyat kecil tolak pasal tembakau rpp uu sehat banyak rakyat kecil kalau terima pajak turun bakal rakyat kecil yang dampak hadehh tolakpasaltembakaurppkesehatan republik indonesia,Negatif,,,
1.75E+18,tolak rpp uu sehat tembakau bikin negara rugi tolakpasaltembakaurppkesehatan republik indonesia,Netral,,,
1.75E+18,please banyak tolak pasal tembakau rpp uu sehat jangan kalau terima pajak turun rakyak kecil yang dampak tolakpasaltembakaurppkesehatan republik indonesia,Positif,,,
1.75E+18,bapak republik indonesia pikir lebih matang deh kait pasal tembakau sangat efek rugi buat banyak orang pokok harus tolak pasal tembakau rpp uu sehat tolakpasaltembakaurppkesehatan,Positif,,,
1.75E+18,dampak lelah dampak langsung tolak pasal tembakau rpp uu sehat coba kalau terima pajak turun yang bakal rugi rakyat kecil tolakpasaltembakaurppkesehatan republik indonesia,Negatif,,,
1.75E+18,nah makanya perlu sangat tolak rpp uu sehat banyak orang rugi negara ancam rugi harus timbang isi bagaimana tolakpasaltembakaurppkesehatan republik indonesia,Positif,,,
1.75E+18,nah dampak ke ekonomi negara tolak pasal tembakau rpp uu sehat lah republik indonesia tolakpasaltembakaurppkesehatan,Netral,,,
1.75E+18,sangat rpp uu sehat timbang baik buruk beri solusi baik tidak rugi negara tolakpasaltembakaurppkesehatan republik indonesia,Positif,,,
1.75E+18,sudah tolak pasal tembakau rpp uu sehat tolakpasaltembakaurppkesehatan kemarin belum solusi moga kalau negara bakal hilang pajak cari solusi baik republik indonesia bapak bu,Positif,,,
1.75E+18,benar kan kalau atur potensi ngerugiin negara haru tolak pasal tembakau rpp uu sehat lah republik indonesia tolakpasaltembakaurppkesehatan,Positif,,,
1.75E+18,kannn prof bilang apalagi ada kesah rpp uu sehat banyak rugi banyak kepala keluarga yang bakal hilang kerja tolakpasaltembakaurppkesehatan republik indonesia,Positif,,,
1.75E+18,pasal tembakau dampak ngerugiin banyak pihak bukan cuma tani tembakau dagang kita tolak pasal tembakau rpp uu sehat republik indonesia tolakpasaltembakaurppkesehatan,Positif,,,
1.75E+18,benar kata prof sendiri tembakau tidak rugi satu regulasi nah ada rpp uu sehat hrsnya timbang tolakpasaltembakaurppkesehatan republik indonesia,Positif,,,
1.75E+18,kalau dampak buat ngerugiin negara arti memang harus tolak pasal tembakau rpp uu sehat republik indonesia tolakpasaltembakaurppkesehatan,Netral,,,
1.75E+18,kemarin ramai orang tolak pasal tembakau rpp uu sehat tolakpasaltembakaurppkesehatan belum solusi sekarang tahu negara bisa hilang dapat pajak mohon cerah deh republik indonesia,Netral,,,
1.75E+18,ngeri nyata dampak atur tenbakau sudah kita tolak pasal tembakau rpp uu sehat republik indonesia tolakpasaltembakaurppkesehatan,Netral,,,
1.75E+18,lihat rugi banyak harus tolak pasal tembakau rpp uu sehat republik indonesia tolakpasaltembakaurppkesehatan,Positif,,,
1.75E+18,tunggu sikap bakal ambil orang lama tolak pasal tembakau rpp uu sehat tolakpasaltembakaurppkesehatan republik indonesia kalau negara potensi rugi gin masak tetap diemin tidak,Negatif,,,
1.75E+18,negara bisa rugi atur bukan para dagang tani sudah kita tolak pasal tembakau rpp uu sehat republik indonesia tolakpasaltembakaurppkesehatan,Netral,,,
1.75E+18,bukan cuma tani dagang rugi ekonomi negara sudah kita tolak pasal tembakau rpp uu sehat republik indonesia tolakpasaltembakaurppkesehatan,Netral,,,
1.75E+18,ternyta cuma satu pihak tolak pasal tembakau rpp uu sehat tolakpasaltembakaurppkesehatan memang rugi bahkan negara bisa ikut rugi tunggu deh solusi baik republik indonesia,Positif,,,
1.75E+18,soal tolak pasal tembakau rpp uu sehat memang kek sisi mata pisau tolakpasaltembakaurppkesehatan moga republik indonesia kasih solusi jalan tengah baik,Positif,,,
1.75E+18,haloo izin ikut anyway thank uu for giveaway moga kakak selalu beri sehat lancar rezeki mudah segala urus aamiin be happy stay healthy and have great day,Positif,,,
